{
  "privateSetupAgentBundleId": "privatesetupagentbundle-003",
  "generatedAt": "2026-06-07T10:40:00Z",
  "scope": "domain_agnostic",
  "runtimeStatus": "bundle_guidance_only",
  "bundleKind": "known_request",
  "sourceKind": "auto_evidence_connector",
  "requestSummary": {
    "privateSetupRequestSetId": "privatesetuprequestset-001",
    "privateSetupRequestId": "privatesetuprequest-003",
    "requestRowId": "privatesetuprequestrow-003",
    "setupMode": "extend_setup",
    "selectedSourceKind": "auto_evidence_connector",
    "forecastQuestionText": "Estimate a future operational probability from caller-approved auto evidence connector sources.",
    "outputType": "binary",
    "sourcePolicy": {
      "dataMode": "auto",
      "allowedSourceKinds": [
        "auto_evidence_connector"
      ],
      "approvalStatus": "not_required",
      "allowLiveFetch": false,
      "allowCredentialUse": false
    }
  },
  "actionSummary": {
    "privateSetupFirstActionId": "privatesetupfirstaction-003",
    "actionStatus": "fixture_ready",
    "routeDecision": "use_fixture_evidence",
    "allowedEntrypoint": "auto_evidence_fixture",
    "commandToRun": "python3 scripts/ope.py gather-evidence",
    "requiredCallerAction": "provide an accepted auto-evidence fixture request",
    "errorCode": "none",
    "exitCode": 0
  },
  "runbookGuidance": {
    "privateSetupFirstActionRunbookId": "privatesetupactionrunbook-001",
    "runbookRowId": "privatesetupactionrunbookrow-003",
    "nextActionLabel": "run_fixture_evidence",
    "expectedOutputClass": "evidence_source_set",
    "requiresCallerConfirmation": false,
    "mayEnterSourceIntakeAfterRequiredAction": false,
    "forecastExecutionAllowed": false,
    "scoringAllowed": false,
    "blockedOutputs": [
      "source_manifest",
      "field_mapping",
      "forecast_artifact",
      "forecast_card",
      "scoring_report",
      "credential_record",
      "live_fetch_result"
    ],
    "stopCondition": "Stop before treating fixture evidence as production live gathering.",
    "agentInstruction": "Run fixture evidence gathering only for an accepted source policy; keep live fetching out of normal checks."
  },
  "claimBoundary": {
    "bundleDoesNotPredict": true,
    "qualityClaimAllowed": false,
    "forecastExecutionAllowed": false,
    "scoringAllowed": false,
    "reasonCodes": [
      "setup_guidance_only",
      "forecast_requires_later_gates",
      "quality_claim_requires_resolved_samples"
    ]
  },
  "executionBoundary": {
    "bundleDoesNotExecute": true,
    "normalChecksOffline": true,
    "readsPrivateData": false,
    "runsSuggestedCommand": false,
    "createsSourceManifests": false,
    "createsFieldMappings": false,
    "createsForecastArtifacts": false,
    "createsScoringRecords": false,
    "storesCredentials": false
  },
  "warnings": [
    "This bundle joins setup guidance records; it does not execute the suggested command.",
    "Source intake, forecast execution, resolution, and scoring remain separate explicit steps.",
    "The bundle does not predict, score, fetch live data, or store credentials."
  ]
}
