{
  "privateSetupAgentBundleId": "privatesetupagentbundle-005",
  "generatedAt": "2026-06-07T10:40:00Z",
  "scope": "domain_agnostic",
  "runtimeStatus": "bundle_guidance_only",
  "bundleKind": "known_request",
  "sourceKind": "private_api",
  "requestSummary": {
    "privateSetupRequestSetId": "privatesetuprequestset-001",
    "privateSetupRequestId": "privatesetuprequest-005",
    "requestRowId": "privatesetuprequestrow-005",
    "setupMode": "new_setup",
    "selectedSourceKind": "private_api",
    "forecastQuestionText": "Estimate a future operational probability from caller-approved private api sources.",
    "outputType": "binary",
    "sourcePolicy": {
      "dataMode": "provided",
      "allowedSourceKinds": [
        "private_api"
      ],
      "approvalStatus": "confirmed",
      "allowLiveFetch": false,
      "allowCredentialUse": false
    }
  },
  "actionSummary": {
    "privateSetupFirstActionId": "privatesetupfirstaction-005",
    "actionStatus": "runtime_not_implemented",
    "routeDecision": "wait_for_runtime",
    "allowedEntrypoint": "no_current_entrypoint",
    "commandToRun": "none",
    "requiredCallerAction": "wait for a checked runtime before retrying",
    "errorCode": "runtime_not_implemented",
    "exitCode": 0
  },
  "runbookGuidance": {
    "privateSetupFirstActionRunbookId": "privatesetupactionrunbook-001",
    "runbookRowId": "privatesetupactionrunbookrow-005",
    "nextActionLabel": "wait_for_runtime",
    "expectedOutputClass": "none",
    "requiresCallerConfirmation": false,
    "mayEnterSourceIntakeAfterRequiredAction": false,
    "forecastExecutionAllowed": false,
    "scoringAllowed": false,
    "blockedOutputs": [
      "source_manifest",
      "field_mapping",
      "source_intake_report",
      "forecast_artifact",
      "forecast_card",
      "scoring_report",
      "credential_record",
      "live_fetch_result"
    ],
    "stopCondition": "Stop until a checked runtime exists for this source kind.",
    "agentInstruction": "Tell the caller this source kind needs a future checked runtime before OPE can inspect it."
  },
  "claimBoundary": {
    "bundleDoesNotPredict": true,
    "qualityClaimAllowed": false,
    "forecastExecutionAllowed": false,
    "scoringAllowed": false,
    "reasonCodes": [
      "setup_guidance_only",
      "forecast_requires_later_gates",
      "quality_claim_requires_resolved_samples",
      "source_not_eligible_for_intake"
    ]
  },
  "executionBoundary": {
    "bundleDoesNotExecute": true,
    "normalChecksOffline": true,
    "readsPrivateData": false,
    "runsSuggestedCommand": false,
    "createsSourceManifests": false,
    "createsFieldMappings": false,
    "createsForecastArtifacts": false,
    "createsScoringRecords": false,
    "storesCredentials": false
  },
  "warnings": [
    "This bundle joins setup guidance records; it does not execute the suggested command.",
    "Source intake, forecast execution, resolution, and scoring remain separate explicit steps.",
    "The bundle does not predict, score, fetch live data, or store credentials."
  ]
}
