{
  "privateSetupAgentBundleId": "privatesetupagentbundle-009",
  "generatedAt": "2026-06-07T10:40:00Z",
  "scope": "domain_agnostic",
  "runtimeStatus": "bundle_guidance_only",
  "bundleKind": "bad_request_example",
  "sourceKind": "spreadsheet_macro",
  "requestSummary": {
    "privateSetupRequestSetId": "privatesetuprequestset-001",
    "privateSetupRequestId": "privatesetuprequest-990",
    "requestRowId": "privatesetuprequestrow-990",
    "setupMode": "unknown",
    "selectedSourceKind": "spreadsheet_macro",
    "forecastQuestionText": "Estimate a future operational probability from caller-approved sources.",
    "outputType": "binary",
    "sourcePolicy": {
      "dataMode": "provided",
      "allowedSourceKinds": [
        "spreadsheet_macro"
      ],
      "approvalStatus": "confirmed",
      "allowLiveFetch": false,
      "allowCredentialUse": false
    }
  },
  "actionSummary": {
    "privateSetupFirstActionId": "privatesetupfirstaction-990",
    "actionStatus": "bad_request",
    "routeDecision": "reject_bad_request",
    "allowedEntrypoint": "no_current_entrypoint",
    "commandToRun": "none",
    "requiredCallerAction": "replace the source kind with a declared adapter",
    "errorCode": "unknown_source_kind",
    "exitCode": 2
  },
  "runbookGuidance": {
    "privateSetupFirstActionRunbookId": "privatesetupactionrunbook-001",
    "runbookRowId": "privatesetupactionbadrequestrow-001",
    "nextActionLabel": "replace_source",
    "expectedOutputClass": "none",
    "requiresCallerConfirmation": false,
    "mayEnterSourceIntakeAfterRequiredAction": false,
    "forecastExecutionAllowed": false,
    "scoringAllowed": false,
    "blockedOutputs": [
      "source_manifest",
      "field_mapping",
      "source_intake_report",
      "forecast_artifact",
      "forecast_card",
      "scoring_report",
      "credential_record",
      "live_fetch_result"
    ],
    "stopCondition": "Stop until the caller replaces the source kind with a declared adapter.",
    "agentInstruction": "Do not infer a connector for unknown source kinds; ask for a declared source replacement."
  },
  "claimBoundary": {
    "bundleDoesNotPredict": true,
    "qualityClaimAllowed": false,
    "forecastExecutionAllowed": false,
    "scoringAllowed": false,
    "reasonCodes": [
      "setup_guidance_only",
      "forecast_requires_later_gates",
      "quality_claim_requires_resolved_samples",
      "source_not_eligible_for_intake"
    ]
  },
  "executionBoundary": {
    "bundleDoesNotExecute": true,
    "normalChecksOffline": true,
    "readsPrivateData": false,
    "runsSuggestedCommand": false,
    "createsSourceManifests": false,
    "createsFieldMappings": false,
    "createsForecastArtifacts": false,
    "createsScoringRecords": false,
    "storesCredentials": false
  },
  "warnings": [
    "This bundle joins setup guidance records; it does not execute the suggested command.",
    "Source intake, forecast execution, resolution, and scoring remain separate explicit steps.",
    "The bundle does not predict, score, fetch live data, or store credentials."
  ]
}
