{
  "privateSetupAgentBundleId": "privatesetupagentbundle-008",
  "generatedAt": "2026-06-07T10:40:00Z",
  "scope": "domain_agnostic",
  "runtimeStatus": "bundle_guidance_only",
  "bundleKind": "known_request",
  "sourceKind": "unsafe_source",
  "requestSummary": {
    "privateSetupRequestSetId": "privatesetuprequestset-001",
    "privateSetupRequestId": "privatesetuprequest-008",
    "requestRowId": "privatesetuprequestrow-008",
    "setupMode": "new_setup",
    "selectedSourceKind": "unsafe_source",
    "forecastQuestionText": "Estimate a future operational probability from caller-approved unsafe source sources.",
    "outputType": "binary",
    "sourcePolicy": {
      "dataMode": "provided",
      "allowedSourceKinds": [
        "unsafe_source"
      ],
      "approvalStatus": "rejected",
      "allowLiveFetch": false,
      "allowCredentialUse": false
    }
  },
  "actionSummary": {
    "privateSetupFirstActionId": "privatesetupfirstaction-008",
    "actionStatus": "rejected_unsafe_source",
    "routeDecision": "stop",
    "allowedEntrypoint": "no_current_entrypoint",
    "commandToRun": "none",
    "requiredCallerAction": "remove unsafe source input and provide a safe replacement",
    "errorCode": "rejected_unsafe_source",
    "exitCode": 0
  },
  "runbookGuidance": {
    "privateSetupFirstActionRunbookId": "privatesetupactionrunbook-001",
    "runbookRowId": "privatesetupactionrunbookrow-008",
    "nextActionLabel": "stop_unsafe_source",
    "expectedOutputClass": "none",
    "requiresCallerConfirmation": false,
    "mayEnterSourceIntakeAfterRequiredAction": false,
    "forecastExecutionAllowed": false,
    "scoringAllowed": false,
    "blockedOutputs": [
      "source_manifest",
      "field_mapping",
      "source_intake_report",
      "forecast_artifact",
      "forecast_card",
      "scoring_report",
      "credential_record",
      "live_fetch_result"
    ],
    "stopCondition": "Stop permanently for this source input; require a safe replacement.",
    "agentInstruction": "Reject the unsafe source and do not pass it to source intake or forecast execution."
  },
  "claimBoundary": {
    "bundleDoesNotPredict": true,
    "qualityClaimAllowed": false,
    "forecastExecutionAllowed": false,
    "scoringAllowed": false,
    "reasonCodes": [
      "setup_guidance_only",
      "forecast_requires_later_gates",
      "quality_claim_requires_resolved_samples",
      "source_not_eligible_for_intake"
    ]
  },
  "executionBoundary": {
    "bundleDoesNotExecute": true,
    "normalChecksOffline": true,
    "readsPrivateData": false,
    "runsSuggestedCommand": false,
    "createsSourceManifests": false,
    "createsFieldMappings": false,
    "createsForecastArtifacts": false,
    "createsScoringRecords": false,
    "storesCredentials": false
  },
  "warnings": [
    "This bundle joins setup guidance records; it does not execute the suggested command.",
    "Source intake, forecast execution, resolution, and scoring remain separate explicit steps.",
    "The bundle does not predict, score, fetch live data, or store credentials."
  ]
}
