{
  "privateSetupAgentBundleId": "privatesetupagentbundle-001",
  "generatedAt": "2026-06-07T10:40:00Z",
  "scope": "domain_agnostic",
  "runtimeStatus": "bundle_guidance_only",
  "bundleKind": "known_request",
  "sourceKind": "local_file",
  "requestSummary": {
    "privateSetupRequestSetId": "privatesetuprequestset-001",
    "privateSetupRequestId": "privatesetuprequest-001",
    "requestRowId": "privatesetuprequestrow-001",
    "setupMode": "new_setup",
    "selectedSourceKind": "local_file",
    "forecastQuestionText": "Estimate a future operational probability from caller-approved local file sources.",
    "outputType": "binary",
    "sourcePolicy": {
      "dataMode": "provided",
      "allowedSourceKinds": [
        "local_file"
      ],
      "approvalStatus": "not_required",
      "allowLiveFetch": false,
      "allowCredentialUse": false
    }
  },
  "actionSummary": {
    "privateSetupFirstActionId": "privatesetupfirstaction-001",
    "actionStatus": "ready_to_run_checked_command",
    "routeDecision": "run_source_builder",
    "allowedEntrypoint": "source_builder",
    "commandToRun": "python3 scripts/ope.py source-builder",
    "requiredCallerAction": "provide caller-approved local file paths",
    "errorCode": "none",
    "exitCode": 0
  },
  "runbookGuidance": {
    "privateSetupFirstActionRunbookId": "privatesetupactionrunbook-001",
    "runbookRowId": "privatesetupactionrunbookrow-001",
    "nextActionLabel": "run_source_builder",
    "expectedOutputClass": "source_manifest_build",
    "requiresCallerConfirmation": false,
    "mayEnterSourceIntakeAfterRequiredAction": true,
    "forecastExecutionAllowed": false,
    "scoringAllowed": false,
    "blockedOutputs": [
      "forecast_artifact",
      "forecast_card",
      "scoring_report",
      "credential_record",
      "live_fetch_result"
    ],
    "stopCondition": "Stop before source intake until source-builder drafts are reviewed and handed off.",
    "agentInstruction": "Run source-builder only for caller-approved local files, then route drafts through source-handoff."
  },
  "claimBoundary": {
    "bundleDoesNotPredict": true,
    "qualityClaimAllowed": false,
    "forecastExecutionAllowed": false,
    "scoringAllowed": false,
    "reasonCodes": [
      "setup_guidance_only",
      "forecast_requires_later_gates",
      "quality_claim_requires_resolved_samples"
    ]
  },
  "executionBoundary": {
    "bundleDoesNotExecute": true,
    "normalChecksOffline": true,
    "readsPrivateData": false,
    "runsSuggestedCommand": false,
    "createsSourceManifests": false,
    "createsFieldMappings": false,
    "createsForecastArtifacts": false,
    "createsScoringRecords": false,
    "storesCredentials": false
  },
  "warnings": [
    "This bundle joins setup guidance records; it does not execute the suggested command.",
    "Source intake, forecast execution, resolution, and scoring remain separate explicit steps.",
    "The bundle does not predict, score, fetch live data, or store credentials."
  ]
}
